,Type,Post_id,Title,Author,Timestamp,Text,Score,Total_comments,Post_URL
0,Post,1ct2adh,Why the 115 charges have yet to be adjuadjusted: by Swedish Rumble,Pale-Dragonfruit3577,1715825648.0,,1,0,https://www.reddit.com/gallery/1cspjsf
1,Post,1ct1i0b,"Hey Goons, very proud of our boys regardless of what happens Sunday. ",Jackfish2800,1715823279.0,"Look, they made tremendous strides this year. Really all the offseason moves and acquisitions worked out beyond our expectations and are A+ moves except for Timber, which is an incomplete due to injury. 

Arteta knows his shit, and clearly the organization is on top of its game on player development and acquisition. 

Raya is probably better than Ramsdale, but if we lose the championship by one on GD, i have bone to pick with him. 

Rice is everything we expected and more. 

Harvertz, who I called Hazard due to being out of position so much, has turned out even better than expected and a great addition. 

Trossard, who some guys might end up being the biggest surprise in the mix has turned into exactly that. 

We are really one more good goal scoring striker, and I said it that way on purpose, from winning it all this year.  We all forget how young this team is sometimes.

Compared to just barely missing out on champions league every year, we are in a much stronger position. 

Geaux Gunners and Geaux to hell Chicken Cocks and MC. ",2,0,https://www.reddit.com/r/ArsenalFC/comments/1ct1i0b/hey_goons_very_proud_of_our_boys_regardless_of/
2,Post,1ct0xwt,Arsenal Direct… New kit coming 👀👀,Sweaty_Driver_867,1715821531.0,The arsenal direct site took down the home kits. Will you be purchasing the new kit right away?,0,0,https://i.redd.it/p212gxfcuo0d1.jpeg
3,Post,1ct0p72,Arsenal at Lincoln Field in Philly sideline set up,BoardgameBitch,1715820798.0,Planning on buying the tickets shortly. When we saw them in Baltimore it was clearly identified which side the teams would be on but I can’t seem to find out. Anyone know if they’re on the west or east side?,2,2,https://www.reddit.com/r/ArsenalFC/comments/1ct0p72/arsenal_at_lincoln_field_in_philly_sideline_set_up/
4,Comment,1ct0p72,Arsenal at Lincoln Field in Philly sideline set up,AutoModerator,2024-05-16 00:53:19,"This post appears to be related to tickets. The mods wish to remind folks that we have *NO* ability to assist with ticket purchases, including through Ticketmaster, resellers, or if you buy tickets from another user. Buyer beware, period. A reminder that ticket scams *do* exist, so be careful. Also, please note sharing of presale codes, or repetitive posting re: tickets will be removed.

*I am a bot, and this action was performed automatically. Please [contact the moderators of this subreddit](/message/compose/?to=/r/ArsenalFC) if you have any questions or concerns.*",1,0,
5,Post,1ct0k9u,Did Tottenham lose the “one game” or did Arsenal lose “five games”?,thatssubjective,1715820375.0,"Is it not a teams responsibility to win the premier league not rely on other teams to win it for them?
I think blaming Tottenham for not winning arsenal the league is as bad Tottenham fans happy to lose a game. 
Here is hoping Arsenal wins its last game. Then will it be west hams fault? Or will west ham win the title?",0,5,https://www.reddit.com/r/ArsenalFC/comments/1ct0k9u/did_tottenham_lose_the_one_game_or_did_arsenal/
6,Comment,1ct0k9u,Did Tottenham lose the “one game” or did Arsenal lose “five games”?,Redwings1927,2024-05-16 01:00:30,"Nobody is BLAMING Tottenham. Nobody. We're disappointed that they lost, but that one loss didn't win city the league.",7,0,
7,Comment,1ct0k9u,Did Tottenham lose the “one game” or did Arsenal lose “five games”?,peoplepersonmanguy,2024-05-16 01:03:16,"In a vacuum

Arsenal lost one more game than they were allowed.

In reality 

City built a team on the back of shonky practices so that even a team, who have won the league undefeated, that exceeds their best ever wins record doesn't win the league.

This is also not even close to comparing to when Liverpool scored almost 100 points and didn't win it.

Aside from that Spurs fans twerked for city to beat them. That is why we will give them shit for losing this game.",6,0,
8,Comment,1ct0k9u,Did Tottenham lose the “one game” or did Arsenal lose “five games”?,Elegant_Mix7650,2024-05-16 01:08:39,"You are getting it wrong. We are not laughing at Tottenham because they lost because lets be honest, that was a crazy run of fixtures with barely any breathing room in between I think even the best team will struggle. The manager and players are professionals and will want to win every game. If you lose a game.. you lose a game.. end of.

What we are laughing at is the fanbase, their culture and their loser mentality. Mourinho said it was the only fanbase he could not connect with, Conte said in all his years of management he has not seen anything as bad (and that Man has managed in lower teams in Italy) and now Ange... (who has never managed in a top 5 league btw), is slowly starting to understand that Spurs may be the shittiest club he has ever managed.",4,0,
9,Comment,1ct0k9u,Did Tottenham lose the “one game” or did Arsenal lose “five games”?,Patient_Customer9827,2024-05-16 01:02:20,Yeah guys like this have completely missed the plot.,3,0,
10,Comment,1ct0k9u,Did Tottenham lose the “one game” or did Arsenal lose “five games”?,Cailucci,2024-05-16 01:54:24,This is the way,1,0,
11,Post,1csxyqb,Liverpool 0 v Arsenal 2 | 1988/89,Renegadeforever2024,1715812848.0,,2,0,https://v.redd.it/gk1iamli4o0d1
12,Post,1cswk4o,Pubs for the game Sunday,k_tnf,1715809192.0,"Any recommendations for pubs you’d be able to get into on Sunday around the Emirates to watch the match?
Don’t have a match ticket and only get into London on Sunday so can’t go to the Tollington…",1,1,https://www.reddit.com/r/ArsenalFC/comments/1cswk4o/pubs_for_the_game_sunday/
13,Comment,1cswk4o,Pubs for the game Sunday,AutoModerator,2024-05-15 21:39:52,"This post appears to be related to tickets. The mods wish to remind folks that we have *NO* ability to assist with ticket purchases, including through Ticketmaster, resellers, or if you buy tickets from another user. Buyer beware, period. A reminder that ticket scams *do* exist, so be careful. Also, please note sharing of presale codes, or repetitive posting re: tickets will be removed.

*I am a bot, and this action was performed automatically. Please [contact the moderators of this subreddit](/message/compose/?to=/r/ArsenalFC) if you have any questions or concerns.*",1,0,
14,Post,1csukoy,Ange Postecoglou didn't hold back,Marshallm-4771,1715804044.0,,1,1,https://v.redd.it/16vojd6kpf0d1
15,Comment,1csukoy,Ange Postecoglou didn't hold back,ChrisMartins001,2024-05-15 21:36:33,Why did someone make this?,1,0,
16,Post,1csu1hu,#DoItForDeclan,ColourCoDead,1715802740.0,"It’s inevitable, but if by any chance… Gooners 🤝 Irons, #DoItForDeclan. Any West Ham fans strolling through to see the vibes, just think, the bonus your team will get from Declan winning the league, might be enough to get another signing in for Mr Lopetegui. ",5,1,https://www.reddit.com/r/ArsenalFC/comments/1csu1hu/doitfordeclan/
17,Comment,1csu1hu,#DoItForDeclan,shitlif,2024-05-15 20:06:19,Do it for premier league football in general..everyone’s sick of these cheating city cunts,6,0,
18,Post,1cstyvu,Things didn't work out for Gunnersaurus yesterday :(,MattyRunRun,1715802563.0,"https://preview.redd.it/79tvvcnx9n0d1.jpg?width=2160&format=pjpg&auto=webp&s=595d1a5c11bbbf4406046246e02164f905883736

",4,2,https://www.reddit.com/r/ArsenalFC/comments/1cstyvu/things_didnt_work_out_for_gunnersaurus_yesterday/
19,Comment,1cstyvu,Things didn't work out for Gunnersaurus yesterday :(,Infinite-Storage-638,2024-05-15 20:41:53,How can you tell that's Gunnersaurus?,3,0,
20,Comment,1cstyvu,Things didn't work out for Gunnersaurus yesterday :(,MattyRunRun,2024-05-15 21:13:26,You're right. My bad. I shouldn't have made assumptions. :),2,0,
21,Post,1cstegu,WTF…,chagrinfalls1979,1715801136.0,Show me another picture where the entire Arsenal fanbase went from elation to being absolutely gutted in 3-4 seconds…Son has never missed this finish in his goddamn life.,106,40,https://i.redd.it/de9x3i3p5n0d1.jpeg
22,Comment,1cstegu,WTF…,AvailableFig2688,2024-05-15 20:01:45,Son of a b*tch.,49,0,
23,Comment,1cstegu,WTF…,PetrogradkaIcedTea,2024-05-15 21:04:08,I’d get you one of Lord Bendtner shooting wide away to Barcelona after RVP’s preposterous red card. A goal woulda taken us past them in the Champo.,18,0,
24,Comment,1cstegu,WTF…,ManiacalComet40,2024-05-15 21:02:33,Would have been so much worse if he had scored it and they still conceded the penalty five minutes later.,27,0,
25,Comment,1cstegu,WTF…,jovzta,2024-05-16 00:25:22,Son has 1/3 to 2/5 of the goal to his right to score but decided to take the harder option.,6,0,
26,Comment,1cstegu,WTF…,LewyH91,2024-05-15 20:53:51,Tried to meg him,3,0,
27,Comment,1cstegu,WTF…,Fendenburgen,2024-05-15 23:03:08,And we're saying their supporters are obsessed with us.....,3,0,
28,Comment,1cstegu,WTF…,Prodigy_7991,2024-05-16 01:49:59,Trash. Pure Trash,1,0,
29,Comment,1cstegu,WTF…,Anglo96,2024-05-15 23:59:51,Hang that one in the louvre and add Ødegaard taking a picture in the corner,2,0,
30,Comment,1cstegu,WTF…,dazzzzzellis,2024-05-15 21:58:11,"get over it, don’t make this a thing pls! people miss 1v1 every season i cba seeing this as a season defying moment",1,0,
31,Comment,1cstegu,WTF…,Soldiiier__,2024-05-16 00:11:04,I swear it didnt look like he took the shot from that far when I saw it live,1,0,
32,Comment,1cstegu,WTF…,bloodhound83,2024-05-15 23:08:23,"It's quite a distance from the goal and the keeper came out well. 

Not a sitter everyone assumes it is.",0,0,
33,Comment,1cstegu,WTF…,Mugweiser,2024-05-15 20:44:32,He didn’t miss - keeper saved it,-1,0,
34,Comment,1cstegu,WTF…,KingKFCc,2024-05-15 21:16:33,Fabregas on that christmas day :(,1,0,
35,Comment,1cstegu,WTF…,muskyangler,2024-05-15 22:31:26,We can't take credit for ending your season.  Unai Emery can.,1,0,
36,Comment,1cstegu,WTF…,Cpl-Wallace,2024-05-15 21:09:57,Not Sons job to win your title for you.,-16,0,
37,Comment,1cstegu,WTF…,Procrastinet_7,2024-05-16 00:22:48,B*tch of a Son,12,0,
38,Comment,1cstegu,WTF…,LicensedRealtor,2024-05-15 23:50:57,That game felt like amateurs on purpose from hotshit spurs,2,0,
39,Comment,1cstegu,WTF…,ChrisMartins001,2024-05-15 21:38:48,I can still feel my blood pressure raising for RVPs red.,16,0,
40,Comment,1cstegu,WTF…,keyboardRacer777,2024-05-15 21:24:17,Damn this still sits in my memory after more than 10 years,8,0,
41,Comment,1cstegu,WTF…,chagrinfalls1979,2024-05-15 21:45:21,<shudders>,3,0,
42,Comment,1cstegu,WTF…,k4mb31,2024-05-16 01:58:26,That red was criminal,1,0,
43,Comment,1cstegu,WTF…,k4mb31,2024-05-16 01:57:53,"""Barn door"" Bendtner, as in couldn't hit the side of",1,0,
44,Comment,1cstegu,WTF…,chagrinfalls1979,2024-05-15 21:44:43,"They pull even, they probably would have changed their style of play…good chance the penalty never happens.",18,0,
45,Comment,1cstegu,WTF…,tbc12389,2024-05-15 22:54:03,There would’ve been no penalty. This goal would’ve changed the run of play.,5,0,
46,Comment,1cstegu,WTF…,daneats,2024-05-16 00:44:22,Son only scores 42% of his 1 on 1’s and that’s the highest conversion rate from that goal scoring position in the league. So just based on the odds alone. There was more chance he misses there than scores. The only reason it feels shit is because he has scored so many of them in the past.,2,0,
47,Comment,1cstegu,WTF…,Internetolocutor,2024-05-15 20:50:24,He kicked it straight at the keeper,16,0,
48,Comment,1cstegu,WTF…,abhi91,2024-05-15 21:36:24,His job is to score goals for his own team. He failed and now will play in Azerbaijan,10,0,
49,Comment,1cstegu,WTF…,chagrinfalls1979,2024-05-15 21:47:22,"Never said he played for Arsenal, more commentary around how he is usually absolutely lethal from that spot and that range…would have helped immensely, yes, but the game wasn’t over after that and nothing says they wouldn’t throttle the Hammers 8-0 while we only managed a 2-1 victory.",1,0,
50,Comment,1cstegu,WTF…,Danvandop42,2024-05-15 22:40:05,Nah it’s to win games for Spurs.  Did he do that?,1,0,
51,Comment,1cstegu,WTF…,lurking4everr,2024-05-16 02:03:36,His job is to try and win trophies for his team. You can safely say it’s been a total failure.,1,0,
52,Comment,1cstegu,WTF…,daneats,2024-05-16 00:42:18,Tbf. Fired more shots than Arsenal against city.,1,0,
53,Comment,1cstegu,WTF…,EmbarrassedMelvin,2024-05-15 21:47:18,They needed a win. Also they are Spurs so they inevitably would have found a way to lose,19,0,
54,Comment,1cstegu,WTF…,ManiacalComet40,2024-05-15 22:55:08,They’d still be Spurs.,3,0,
55,Comment,1cstegu,WTF…,chagrinfalls1979,2024-05-15 20:57:03,Completely…I’ve seen Son feather that finish expertly around the keeper or chip it over as Ortega was already on his way down when he made the attempt…frustrating.,10,0,
56,Comment,1cstegu,WTF…,Dwo92,2024-05-15 23:31:28,He was going for the between the legs finish,1,0,
57,Comment,1cstegu,WTF…,chagrinfalls1979,2024-05-15 21:48:00,So very true…poor Ange…,5,0,
58,Comment,1cstegu,WTF…,theot12,2024-05-16 00:59:35,And they’d still be shite,1,0,
59,Comment,1cstegu,WTF…,yourlocallidl,2024-05-15 22:47:25,"Son would give his life to Spurs, did you think he’d score against City to do you lot a favour, lol",-11,0,
60,Post,1cssmo2,The deal I just made with my West Ham mates,kiwigone,1715799204.0,"If West Ham draw on Sunday I won’t bad mouth them for all of next season.

If West Ham win then I will wear their shirt for a week.

I’m doing my part …",15,11,https://www.reddit.com/r/ArsenalFC/comments/1cssmo2/the_deal_i_just_made_with_my_west_ham_mates/
61,Comment,1cssmo2,The deal I just made with my West Ham mates,sexualinnuend,2024-05-15 19:34:50,If west ham draws or wins ill get an arsenal tattoo. We're all doing our part mate,10,0,
62,Comment,1cssmo2,The deal I just made with my West Ham mates,btg1911,2024-05-15 23:22:28,"With the way the fucking spurs fans relished in losing yesterday, I want to believe there is some cosmic reckoning coming on Sunday.",5,0,
63,Comment,1cssmo2,The deal I just made with my West Ham mates,West-Painter-7520,2024-05-15 22:30:56,And if they lose?,2,0,
64,Comment,1cssmo2,The deal I just made with my West Ham mates,kw2006,2024-05-15 23:49:08,If West Ham won you better wear their jersey when they play against us.,1,0,
65,Comment,1cssmo2,The deal I just made with my West Ham mates,DJL1981,2024-05-16 01:49:35,"Fuck it, if the boys have got snowballs chance in hell of winning the premiership I’m all in, come on hammers.
Also love this team and so happy with the season win or lose",1,0,
66,Comment,1cssmo2,The deal I just made with my West Ham mates,Longjumping_Act9758,2024-05-16 01:50:54,If they win I'm buying a jersey.,1,0,
67,Comment,1cssmo2,The deal I just made with my West Ham mates,BigZaddy64,2024-05-15 20:51:55,"Yall are delusional if you think they can beat city.

Just be happy with the season and focus on next year",1,0,
68,Comment,1cssmo2,The deal I just made with my West Ham mates,kiwigone,2024-05-15 22:34:08,They have to support Chelsea for a season,4,0,
69,Comment,1cssmo2,The deal I just made with my West Ham mates,Brandaman,2024-05-15 23:50:21,"Let’s see what happens. Early penalty and then the legendary Moyes bus park, maybe we’ll see a 1-1 draw",3,0,
70,Comment,1cssmo2,The deal I just made with my West Ham mates,keyboardRacer777,2024-05-15 21:28:20,"Yea, it can be either 0:0 (i give it less than 3% of chance) or anything above 2 goals for city",2,0,
71,Comment,1cssmo2,The deal I just made with my West Ham mates,kw2006,2024-05-15 23:49:49,More likely losing 7-0 to city,1,0,
72,Post,1css8lr,Hey should arsenal sign up Brian Brobbey,Old-Visit-2477,1715798222.0,He is a scoring machine this season with 22 goals and 12 assists,0,2,https://www.reddit.com/r/ArsenalFC/comments/1css8lr/hey_should_arsenal_sign_up_brian_brobbey/
73,Comment,1css8lr,Hey should arsenal sign up Brian Brobbey,Patient_Customer9827,2024-05-15 18:53:57,No he’s actually bad. Just a product of the Eredivisie. I watched him a lot at Leipzig and he floundered against increased competition.,3,0,
74,Comment,1css8lr,Hey should arsenal sign up Brian Brobbey,Nels8192,2024-05-15 21:17:06,"Nah, rather get Watkins.",0,0,
75,Post,1css3bc,"20 years ago, we became Invincible ❤️ 🏆",Educational_Shape36,1715797893.0,,42,6,https://i.redd.it/5u27u712wm0d1.jpeg
76,Comment,1css3bc,"20 years ago, we became Invincible ❤️ 🏆",Big_leaker,2024-05-15 19:11:31,Too soon 🥲 the pain is still raw,5,0,
77,Comment,1css3bc,"20 years ago, we became Invincible ❤️ 🏆",Bootzilla_Rembrant,2024-05-15 20:39:33,Wiltord trying to keep Henry's erection down. Now you can't unsee it.,2,0,
78,Comment,1css3bc,"20 years ago, we became Invincible ❤️ 🏆",PoliticsNerd76,2024-05-15 23:51:52,I’m in no mood lol,1,0,
79,Comment,1css3bc,"20 years ago, we became Invincible ❤️ 🏆",feder_online,2024-05-16 00:50:47,"C'mon, f-ing Hammers. 
We could use a title on the anniversary.",1,0,
80,Comment,1css3bc,"20 years ago, we became Invincible ❤️ 🏆",myriadnoob,2024-05-15 20:02:10,"20 years later, potentially ending the season trophyless. what a shame, we should do better than that",1,0,
81,Comment,1css3bc,"20 years ago, we became Invincible ❤️ 🏆",abanaabeingo420,2024-05-15 21:29:26,"That s Lauren, mate. But good one 😂😂",3,0,
82,Post,1csrck8,Arsenal❤️,petaS_lego_22,1715796209.0,"Today we celebrate 20th anniversary of becoming ''The Invincibles''. Please support my Lego Ideas set and help me to fulfill my dream – become a Lego Ideas designer.

There is official link:
https://ideas.lego.com/projects/ea534897-70bc-40c6-a06e-576bc86d1b17

Support is easy:
-click on the link
-register if you don't have an account yet
-on my set page click on yellow button ''support''

Thank you to all my supporters!",111,11,https://i.redd.it/af3i0um1rm0d1.jpeg
83,Comment,1csrck8,Arsenal❤️,Intelligent-Count-44,2024-05-15 18:17:24,"Love it, supported!",5,0,
84,Comment,1csrck8,Arsenal❤️,The_sheepherder,2024-05-15 19:05:08,Nice mate! I support it,4,0,
85,Comment,1csrck8,Arsenal❤️,Zealousideal-Ebb-415,2024-05-15 19:17:44,Supported! This is so incredibly cool.,4,0,
86,Comment,1csrck8,Arsenal❤️,Pure_Effective4398,2024-05-15 19:22:52,I love Legos and I love Arsenal so this is such an epic crossover for me! Congrats mate.,3,0,
87,Comment,1csrck8,Arsenal❤️,abanaabeingo420,2024-05-15 20:02:41,Post it on r/gunners,3,0,
88,Comment,1csrck8,Arsenal❤️,ChrisMartins001,2024-05-15 19:57:00,"This is class, supported!",2,0,
89,Comment,1csrck8,Arsenal❤️,abanaabeingo420,2024-05-15 20:00:16,Nice one mate!,2,0,
90,Comment,1csrck8,Arsenal❤️,1989danny,2024-05-15 20:59:03,Supported awesome work 👌,2,0,
91,Comment,1csrck8,Arsenal❤️,PaddyTheCoolMan,2024-05-16 00:38:57,"Haven't really been into Lego in years, but I'll definitely be going to the Lego store if they actually turn this idea into a set and buying it.",1,0,
92,Comment,1csrck8,Arsenal❤️,petaS_lego_22,2024-05-15 18:57:43,Thank you🫶🫶,4,0,
93,Comment,1csrck8,Arsenal❤️,petaS_lego_22,2024-05-15 19:08:16,Thanks🫶,3,0,
94,Post,1csqsxu,Scrap VAR? YES PLEASE!,saffermaster,1715794869.0,"EXCLUSIVE: Premier League clubs to vote on proposal to scrap VAR from next season. Resolution formally submitted by Wolves to abolish system + will be on agenda at June 6 AGM. Any rule change needs 2/3s majority (14 of 20 members) to pass (David Ornstein)

  
[https://www.nytimes.com/athletic/5495032/2024/05/15/premier-league-var-vote/](https://www.nytimes.com/athletic/5495032/2024/05/15/premier-league-var-vote/)",0,27,https://www.reddit.com/r/ArsenalFC/comments/1csqsxu/scrap_var_yes_please/
95,Comment,1csqsxu,Scrap VAR? YES PLEASE!,GoonnerWookie,2024-05-15 17:54:40,This will just make it worse. The ones who are running it are the problem,10,0,
96,Comment,1csqsxu,Scrap VAR? YES PLEASE!,JondArc99,2024-05-15 18:49:04,They should be voting to scrap PGMOL,5,0,
97,Comment,1csqsxu,Scrap VAR? YES PLEASE!,syrah-lips,2024-05-15 18:27:17,"It’s frustrating that even with replay, they still make mistakes. But that’s an easier problem to solve than trying to find officials who can make those close calls 100% right without replay. 

There’s no way scrapping VAR makes the game better. It just makes excusing the mistakes easier, and what good is that?",2,0,
98,Comment,1csqsxu,Scrap VAR? YES PLEASE!,myriadnoob,2024-05-15 20:12:52,"keep VAR, throw PGMOL into the trashcan instead.",2,0,
99,Comment,1csqsxu,Scrap VAR? YES PLEASE!,kmart93,2024-05-15 21:25:19,No. Things were way worse before VAR. The problem is the refs not the tech,1,0,
100,Comment,1csqsxu,Scrap VAR? YES PLEASE!,No-Prior7905,2024-05-15 22:28:24,Scrap VAR? What will we complain about then next season?,1,0,
101,Comment,1csqsxu,Scrap VAR? YES PLEASE!,saffermaster,2024-05-15 17:57:49,"For me, VAR has destroyed the essence of football. Errors in officiating are part of the game and on the whole, they balance out through the course of a season. There is no perfection in subjective decisions.",-7,0,
102,Comment,1csqsxu,Scrap VAR? YES PLEASE!,saffermaster,2024-05-15 18:58:07,I TOTALLY agree with that....wankers.,1,0,
103,Comment,1csqsxu,Scrap VAR? YES PLEASE!,saffermaster,2024-05-15 18:39:58,"For me, the automatic VAR for offsides calls is the only solution I would agree to. Otherwise, put a ref in each penalty area for penalty calls.",1,0,
104,Comment,1csqsxu,Scrap VAR? YES PLEASE!,saffermaster,2024-05-15 22:31:52,"like we used to, the refs",1,0,
105,Comment,1csqsxu,Scrap VAR? YES PLEASE!,arsehenry14,2024-05-15 18:10:28,Couldn’t disagree more.  I’m sure the Invincibles would love to have a 50 plus unbeaten streak if there were VAR to review Wayne Rooneys dive.  And yes I’m still bitter about that 20 years later.,10,0,
106,Comment,1csqsxu,Scrap VAR? YES PLEASE!,sophandros,2024-05-15 18:13:49,Getting calls correct has destroyed the essence of football‽,5,0,
107,Comment,1csqsxu,Scrap VAR? YES PLEASE!,saffermaster,2024-05-15 18:26:52,"Well, again, there is no perfect in football. Thats just part of the game. The sad truth is that is the way it has always been. Unless they put 3 more refs on the field, there is no way to prefect imperfection.",1,0,
108,Comment,1csqsxu,Scrap VAR? YES PLEASE!,saffermaster,2024-05-15 18:15:26,They aren't correcting calls they are destroying the game,-7,0,
109,Comment,1csqsxu,Scrap VAR? YES PLEASE!,ddzrt,2024-05-15 19:50:22,"It does not require more refs. They can operate drones and put more cameras to have footage. They can review stuff without stopping the game and announce decisions on any game pause. They can communicate with match going audience and folks watching TV. They can use automated goal line and semi automated offside(that would just require 4 cameras at least) to operate and provide enough visual clarity. They can use screens on stadiums to show video footage of moment reviewed. They do not need match referee to do ""the walk"" to the screen as in VAR room there is another referee who should be able to overturn onfield decisions instead of just backing his pal. Referees can talk to audience. And list of possible solutions goes on and on. 

It is people, the officials that have to be held accountable for how things are done. How rules are written and applied. And audience being proactive enough to ask for stuff to actually get anywhere instead of just going with the flow. It is audience that provides the most crucial thing for this entire thing to exist - money. No audience - no money, no ads, no promo deals. So if audience does not exercise their rights and will - nothing will improve just because.",2,0,
110,Comment,1csqsxu,Scrap VAR? YES PLEASE!,kmart93,2024-05-15 21:26:16,"You're not making an argument, you're just making wild claims",1,0,
111,Comment,1csqsxu,Scrap VAR? YES PLEASE!,understanding_life1,2024-05-15 21:36:20,"How are they destroying the game? Before it was far more common for the ref to make an incorrect offside or penalty call. VAR corrects most of these mistakes. 

Yes it will fall short occasionally but nothings perfect. They are not “ruining the essence of the game”, that’s a nonsense stance.",1,0,
112,Comment,1csqsxu,Scrap VAR? YES PLEASE!,saffermaster,2024-05-15 21:39:38,Your view.,1,0,
113,Comment,1csqsxu,Scrap VAR? YES PLEASE!,saffermaster,2024-05-15 21:39:18,"For me, because you cannot celebrate a goal till after they approve of it. Takes away the emotion of the game. Beyond that, they get as many calls wrong as right and for me, that's not worth destroying the game with unnecessary time outs. If they cannot see with a single replay that there was an egregious error, leave the decision on the field.",1,0,
114,Comment,1csqsxu,Scrap VAR? YES PLEASE!,kmart93,2024-05-15 22:32:10,You're literally not making an argument,1,0,
115,Comment,1csqsxu,Scrap VAR? YES PLEASE!,understanding_life1,2024-05-15 21:46:06,"That is your personal opinion. The facts suggest otherwise - https://pubmed.ncbi.nlm.nih.gov/32794432/

Bottom line is VAR has improved the overall accuracy of a referee’s decision, this is not up for debate. 

I disagree with the emotion part. If anything VAR actually increases the emotion in the game a lot of the time, especially when it comes to a game changing call.",1,0,
116,Comment,1csqsxu,Scrap VAR? YES PLEASE!,saffermaster,2024-05-15 21:59:41,Naa it's a nightmare and has done nothing to improve the game. The marginal improvements in accuracy are far more offset by the disruption. I say bin it.,1,0,
